{
  "id": "saloni-singh",
  "name": "Saloni Singh",
  "tagline": "AWS Community Builder working with GKE at Google, specializing in Kubernetes and cloud automation",
  "bio": "Saloni Singh is an AWS Community Builder currently working at Google with GKE (Google Kubernetes Engine). With 5+ years of hands-on experience, she specializes in cloud solutions, DevOps automation, and container orchestration across AWS and Google Cloud platforms.",
  "avatar": "https://github.com/rksaloni88.png",
  "expertise": {
    "primary": ["Kubernetes", "AWS", "GCP", "DevOps"],
    "secondary": ["Docker", "Terraform", "CI/CD", "Python"]
  },
  "social": {
    "github": "rksaloni88",
    "linkedin": "saloni-singh-aws",
    "twitter": "AwakeOnRequest"
  },
  "content": {
    "blog": "https://medium.com/@singhsaloni890",
    "speaking": true
  },
  "meta": {
    "company": "Google",
    "location": "India",
    "verified": true,
    "added_date": "2025-11-15"
  }
}
