{
  "id": "victor-garcia",
  "name": "Victor Garcia",
  "tagline": "DevOps Engineer and mentor specializing in Kubernetes, Terraform, and cloud automation",
  "bio": "Victor Garcia is a DevOps Engineer at SAP and certified AWS & GCP professional. He specializes in Kubernetes, Docker, Terraform, and cloud automation, offering mentorships on building APIs, DevOps practices, and automating cloud deployments.",
  "avatar": "https://github.com/victorgarciaesgi.png",
  "expertise": {
    "primary": ["DevOps", "Kubernetes", "AWS", "GCP"],
    "secondary": ["Docker", "Terraform", "Python", "CI/CD"]
  },
  "social": {
    "twitter": "VictorGarciaDev",
    "github": "victorgarciaesgi",
    "website": "https://www.victorgarciar.com"
  },
  "content": {
    "blog": "https://dev.to/victorgarciadev",
    "workshops": true
  },
  "meta": {
    "company": "SAP",
    "location": "Madrid, Spain",
    "verified": true,
    "added_date": "2025-11-15"
  }
}
